{
  "target": {
    "repository": "liuchangchxy/dayspark",
    "branch": "main",
    "commit_sha": "2e5fe700d7295d7069c7223547af9cfaa528b4e8",
    "remote": "origin",
    "remote_commit_sha": "2e5fe700d7295d7069c7223547af9cfaa528b4e8",
    "dirty": false
  },
  "project": {
    "name": "dayspark",
    "project_type": "cross-platform application",
    "description": "开源、自托管优先的日历与待办应用（对标 Todo清单 的执行向体验）。Flutter 全平台运行，数据同步与 AI 接口由你自己的服务器掌控。",
    "technologies": [
      "Dart",
      "Flutter"
    ],
    "platforms": [
      "Android",
      "Desktop",
      "Web",
      "iOS"
    ],
    "development_signals": [
      "AI development tooling",
      "GitHub Actions",
      "MCP",
      "server component",
      "tests"
    ]
  },
  "capability_catalog": [
    {
      "id": "engineering-baseline",
      "purpose": "Keep development changes traceable and reviewable through explicit version-control practices.",
      "applicability": {
        "use_when": [
          "A software project needs a shared baseline for recording and inspecting changes."
        ],
        "not_for": [
          "Repository hosting policy or a project-specific branching mandate."
        ]
      },
      "selection_hints": {
        "signals": [
          "Change history and reviewability are required."
        ],
        "constraints": [
          "Choose the actual branching policy with the project owner."
        ]
      },
      "requires": [],
      "conflicts_with": [],
      "bootstrap_components": [
        {
          "id": "reference",
          "delivery": "reference",
          "scope": "external"
        },
        {
          "id": "reviewable-changes",
          "delivery": "copy",
          "scope": "global"
        }
      ]
    },
    {
      "id": "testing",
      "purpose": "Check observable behavior with focused, repeatable tests appropriate to the change.",
      "applicability": {
        "use_when": [
          "Behavior changes need regression evidence.",
          "An executable project needs a test organization convention."
        ],
        "not_for": [
          "A guarantee of correctness from coverage numbers alone."
        ]
      },
      "selection_hints": {
        "signals": [
          "Regression risk or repeatable behavioral checks are relevant."
        ],
        "constraints": [
          "The referenced pytest component applies to Python; other stacks need a suitable component reference.",
          "Test effort must reflect change impact."
        ]
      },
      "requires": [],
      "conflicts_with": [],
      "bootstrap_components": [
        {
          "id": "project-test-guidance",
          "delivery": "copy",
          "scope": "project"
        }
      ]
    },
    {
      "id": "code-review",
      "purpose": "Assess a proposed change for correctness, clarity, and maintainability before acceptance.",
      "applicability": {
        "use_when": [
          "Changes need an explicit review by a person or a separately authorized reviewer."
        ],
        "not_for": [
          "Automatic approval, merge authority, or a substitute for runtime evidence."
        ]
      },
      "selection_hints": {
        "signals": [
          "A reviewable change and acceptance expectations exist."
        ],
        "constraints": [
          "Who reviews and who accepts remain project decisions."
        ]
      },
      "requires": [],
      "conflicts_with": [],
      "bootstrap_components": []
    },
    {
      "id": "documentation",
      "purpose": "Organize explanations, reference material, tutorials, and task guidance around reader needs.",
      "applicability": {
        "use_when": [
          "Project knowledge needs a clear audience and a maintainable documentation structure."
        ],
        "not_for": [
          "Promoting private project facts into global capability records."
        ]
      },
      "selection_hints": {
        "signals": [
          "Readers need guidance or stable reference material."
        ],
        "constraints": [
          "Project-specific content stays in the project; this catalog only describes the reusable ability."
        ]
      },
      "requires": [],
      "conflicts_with": [],
      "bootstrap_components": [
        {
          "id": "project-documentation-outline",
          "delivery": "copy",
          "scope": "project"
        }
      ]
    },
    {
      "id": "planning",
      "purpose": "Make goals, scope, acceptance conditions, and work dependencies explicit before implementation.",
      "applicability": {
        "use_when": [
          "Work has multiple steps or unresolved scope that benefits from a shared plan."
        ],
        "not_for": [
          "Mandatory ceremony for every small edit or automatic task execution."
        ]
      },
      "selection_hints": {
        "signals": [
          "Scope, dependencies, or acceptance conditions need clarification."
        ],
        "constraints": [
          "GitHub issues are one possible component, not a required host.",
          "Planning depth follows project complexity and user preference."
        ]
      },
      "requires": [],
      "conflicts_with": [],
      "bootstrap_components": []
    },
    {
      "id": "debugging",
      "purpose": "Reproduce a failure and inspect execution evidence to distinguish observations from hypotheses.",
      "applicability": {
        "use_when": [
          "A concrete failure or discrepancy needs a bounded investigation."
        ],
        "not_for": [
          "Speculative fallback code without a reproduced failure or known requirement."
        ]
      },
      "selection_hints": {
        "signals": [
          "An observed failure, reproducible input, or discrepancy is available."
        ],
        "constraints": [
          "The pdb component applies to Python; use a suitable debugger for another runtime.",
          "An investigation does not establish a root cause until evidence supports it."
        ]
      },
      "requires": [],
      "conflicts_with": [],
      "bootstrap_components": []
    },
    {
      "id": "research-workflow",
      "purpose": "Preserve methods, inputs, and evidence so research findings can be examined and reproduced.",
      "applicability": {
        "use_when": [
          "An investigation or experiment must report provenance, outcomes, and limitations."
        ],
        "not_for": [
          "Automatic Experience extraction or copying private datasets into this catalog."
        ]
      },
      "selection_hints": {
        "signals": [
          "Claims depend on experiments, datasets, or reproducible methods."
        ],
        "constraints": [
          "A source reference is not evidence that this capability improved a real project.",
          "Keep confidential inputs and project observations in their owning project."
        ]
      },
      "requires": [],
      "conflicts_with": [],
      "bootstrap_components": []
    },
    {
      "id": "agent-development",
      "purpose": "Describe an agent system with explicit task boundaries and a way to check its observable behavior.",
      "applicability": {
        "use_when": [
          "A project is intentionally developing agent behavior and needs behavioral acceptance cases."
        ],
        "not_for": [
          "Creating an agent in Bootstrap Phase 2 or granting tools autonomous authority."
        ]
      },
      "selection_hints": {
        "signals": [
          "The product includes agent behavior rather than merely using an AI coding assistant."
        ],
        "constraints": [
          "Testing is a catalog prerequisite for checking agent behavior.",
          "Tool permissions, evaluation cases, and runtime choices remain project-specific."
        ]
      },
      "requires": [
        "testing"
      ],
      "conflicts_with": [],
      "bootstrap_components": []
    }
  ],
  "discovered_assets": [
    {
      "path": ".claude/skills/release-prep/SKILL.md",
      "asset_type": "skill",
      "ownership": "project_owned",
      "summary": "Dev-to-Release Pipeline / 开发到发版流水线",